{
  "schema_version": 1,
  "product": "pixCAM 0.3.0",
  "document": "bridge-part",
  "units": "mm",
  "read_only": true,
  "bodies": [
    {
      "name": "BridgePlate",
      "bbox": {
        "min": [
          -3.108624468950765e-15,
          0.0,
          -6.661338147750937e-15
        ],
        "max": [
          100.0,
          70.0,
          30.00000000000001
        ]
      }
    }
  ],
  "features": [
    {
      "id": "CY01",
      "body": "BridgePlate",
      "face_indices": [
        4,
        5
      ],
      "face_names": [
        "F2:bore:side:1",
        "F2:bore:side:0"
      ],
      "evidence_level": "VERIFIED_GEOMETRY",
      "diameter_mm": 6.000000000000011,
      "axis": [
        0.0,
        0.0,
        1.0
      ],
      "axis_origin_mm": [
        19.99999999999999,
        19.999999999999993,
        0.0
      ],
      "axial_range_mm": [
        0.0,
        29.99999999999999
      ],
      "boundary_span_mm": 29.99999999999999,
      "cad_from_local": [
        [
          0.0,
          1.0,
          0.0,
          19.99999999999999
        ],
        [
          -1.0,
          0.0,
          0.0,
          19.999999999999993
        ],
        [
          0.0,
          0.0,
          1.0,
          0.0
        ],
        [
          0.0,
          0.0,
          0.0,
          1.0
        ]
      ],
      "inferred_feature": "cylindrical_hole_candidate",
      "inference_level": "INFERRED_FEATURE",
      "unknown": [
        "Closed 360-degree hole / inward material side",
        "Blind versus through termination (not certified by topology alone)",
        "Threads, tolerances, process and tool"
      ],
      "evidence": "Radius/axis from CAD cylinder; span is projection of named adjacent edge endpoints/midpoints, not an invented hole depth. Hole hypothesis uses CAD persistent naming only."
    },
    {
      "id": "CY02",
      "body": "BridgePlate",
      "face_indices": [
        6,
        7
      ],
      "face_names": [
        "F3:bore:side:1",
        "F3:bore:side:0"
      ],
      "evidence_level": "VERIFIED_GEOMETRY",
      "diameter_mm": 10.000000000000053,
      "axis": [
        0.0,
        0.0,
        1.0
      ],
      "axis_origin_mm": [
        44.999999999999964,
        20.00000000000003,
        0.0
      ],
      "axial_range_mm": [
        17.999999999999996,
        29.99999999999999
      ],
      "boundary_span_mm": 11.999999999999993,
      "cad_from_local": [
        [
          0.0,
          1.0,
          0.0,
          44.999999999999964
        ],
        [
          -1.0,
          0.0,
          0.0,
          20.00000000000003
        ],
        [
          0.0,
          0.0,
          1.0,
          18.0
        ],
        [
          0.0,
          0.0,
          0.0,
          1.0
        ]
      ],
      "inferred_feature": "cylindrical_hole_candidate",
      "inference_level": "INFERRED_FEATURE",
      "unknown": [
        "Closed 360-degree hole / inward material side",
        "Blind versus through termination (not certified by topology alone)",
        "Threads, tolerances, process and tool"
      ],
      "evidence": "Radius/axis from CAD cylinder; span is projection of named adjacent edge endpoints/midpoints, not an invented hole depth. Hole hypothesis uses CAD persistent naming only."
    },
    {
      "id": "CY03",
      "body": "BridgePlate",
      "face_indices": [
        8,
        9
      ],
      "face_names": [
        "F4:cbore:side:1",
        "F4:cbore:side:0"
      ],
      "evidence_level": "VERIFIED_GEOMETRY",
      "diameter_mm": 11.999999999999984,
      "axis": [
        0.0,
        0.0,
        1.0
      ],
      "axis_origin_mm": [
        74.99999999999997,
        20.00000000000001,
        0.0
      ],
      "axial_range_mm": [
        24.99999999999999,
        29.99999999999999
      ],
      "boundary_span_mm": 5.0,
      "cad_from_local": [
        [
          0.0,
          1.0,
          0.0,
          74.99999999999997
        ],
        [
          -1.0,
          0.0,
          0.0,
          20.00000000000001
        ],
        [
          0.0,
          0.0,
          1.0,
          24.99999999999999
        ],
        [
          0.0,
          0.0,
          0.0,
          1.0
        ]
      ],
      "inferred_feature": "cylindrical_hole_candidate",
      "inference_level": "INFERRED_FEATURE",
      "unknown": [
        "Closed 360-degree hole / inward material side",
        "Blind versus through termination (not certified by topology alone)",
        "Threads, tolerances, process and tool"
      ],
      "evidence": "Radius/axis from CAD cylinder; span is projection of named adjacent edge endpoints/midpoints, not an invented hole depth. Hole hypothesis uses CAD persistent naming only."
    },
    {
      "id": "CY04",
      "body": "BridgePlate",
      "face_indices": [
        10,
        11
      ],
      "face_names": [
        "F4:bore:side:1",
        "F4:bore:side:0"
      ],
      "evidence_level": "VERIFIED_GEOMETRY",
      "diameter_mm": 6.000000000000015,
      "axis": [
        0.0,
        0.0,
        1.0
      ],
      "axis_origin_mm": [
        74.99999999999994,
        19.999999999999993,
        0.0
      ],
      "axial_range_mm": [
        0.0,
        24.99999999999999
      ],
      "boundary_span_mm": 24.99999999999999,
      "cad_from_local": [
        [
          0.0,
          1.0,
          0.0,
          74.99999999999994
        ],
        [
          -1.0,
          0.0,
          0.0,
          19.999999999999993
        ],
        [
          0.0,
          0.0,
          1.0,
          0.0
        ],
        [
          0.0,
          0.0,
          0.0,
          1.0
        ]
      ],
      "inferred_feature": "cylindrical_hole_candidate",
      "inference_level": "INFERRED_FEATURE",
      "unknown": [
        "Closed 360-degree hole / inward material side",
        "Blind versus through termination (not certified by topology alone)",
        "Threads, tolerances, process and tool"
      ],
      "evidence": "Radius/axis from CAD cylinder; span is projection of named adjacent edge endpoints/midpoints, not an invented hole depth. Hole hypothesis uses CAD persistent naming only."
    },
    {
      "id": "CY05",
      "body": "BridgePlate",
      "face_indices": [
        17,
        18
      ],
      "face_names": [
        "F5:bore:side:0",
        "F5:bore:side:1"
      ],
      "evidence_level": "VERIFIED_GEOMETRY",
      "diameter_mm": 8.00000000000001,
      "axis": [
        1.0,
        0.0,
        0.0
      ],
      "axis_origin_mm": [
        0.0,
        50.0,
        15.000000000000012
      ],
      "axial_range_mm": [
        -3.552713678800501e-15,
        15.0
      ],
      "boundary_span_mm": 15.000000000000004,
      "cad_from_local": [
        [
          0.0,
          0.0,
          1.0,
          -3.552713678800501e-15
        ],
        [
          0.0,
          1.0,
          0.0,
          50.0
        ],
        [
          -1.0,
          0.0,
          0.0,
          15.000000000000012
        ],
        [
          0.0,
          0.0,
          0.0,
          1.0
        ]
      ],
      "inferred_feature": "cylindrical_hole_candidate",
      "inference_level": "INFERRED_FEATURE",
      "unknown": [
        "Closed 360-degree hole / inward material side",
        "Blind versus through termination (not certified by topology alone)",
        "Threads, tolerances, process and tool"
      ],
      "evidence": "Radius/axis from CAD cylinder; span is projection of named adjacent edge endpoints/midpoints, not an invented hole depth. Hole hypothesis uses CAD persistent naming only."
    }
  ],
  "surfaces": [
    {
      "area_mm2": 2051.164235294109,
      "body": "BridgePlate",
      "centroid_mm": [
        0.0,
        34.64286795860433,
        14.999999999999991
      ],
      "evidence_level": "VERIFIED_GEOMETRY",
      "face_index": 0,
      "kind": "planar",
      "normal": [
        -1.0,
        -0.0,
        0.0
      ],
      "persistent_name": "F1:-x"
    },
    {
      "area_mm2": 2999.999999999999,
      "body": "BridgePlate",
      "centroid_mm": [
        49.99999999999999,
        70.0,
        14.999999999999996
      ],
      "evidence_level": "VERIFIED_GEOMETRY",
      "face_index": 1,
      "kind": "planar",
      "normal": [
        0.0,
        1.0,
        -0.0
      ],
      "persistent_name": "F1:+y"
    },
    {
      "area_mm2": 2099.999999999999,
      "body": "BridgePlate",
      "centroid_mm": [
        100.0,
        35.0,
        14.999999999999991
      ],
      "evidence_level": "VERIFIED_GEOMETRY",
      "face_index": 2,
      "kind": "planar",
      "normal": [
        1.0,
        0.0,
        0.0
      ],
      "persistent_name": "F1:+x"
    },
    {
      "area_mm2": 2999.999999999999,
      "body": "BridgePlate",
      "centroid_mm": [
        49.99999999999999,
        0.0,
        14.999999999999996
      ],
      "evidence_level": "VERIFIED_GEOMETRY",
      "face_index": 3,
      "kind": "planar",
      "normal": [
        0.0,
        -1.0,
        0.0
      ],
      "persistent_name": "F1:-y"
    },
    {
      "area_mm2": 279.24978436260864,
      "body": "BridgePlate",
      "centroid_mm": [
        21.076756866052236,
        18.469197501026947,
        15.0
      ],
      "evidence_level": "VERIFIED_GEOMETRY",
      "face_index": 4,
      "kind": "cylindrical",
      "normal": null,
      "persistent_name": "F2:bore:side:1"
    },
    {
      "area_mm2": 279.2497843626077,
      "body": "BridgePlate",
      "centroid_mm": [
        18.92324313394774,
        21.53080249897305,
        14.999999999999996
      ],
      "evidence_level": "VERIFIED_GEOMETRY",
      "face_index": 5,
      "kind": "cylindrical",
      "normal": null,
      "persistent_name": "F2:bore:side:0"
    },
    {
      "area_mm2": 187.1454905597698,
      "body": "BridgePlate",